<!ELEMENT resources_manifest (resource*)>
<!ELEMENT resource (#PCDATA)>
<!ATTLIST resource
   name         CDATA         #REQUIRED
   info         CDATA         #REQUIRED
   doc          CDATA         #IMPLIED
   support      CDATA         #IMPLIED
   parallel     (true|false)  #IMPLIED
>

